{
  "schema_version": 2,
  "id": "CVE-2026-23274",
  "title": "xt_IDLETIMER revision confusion uses an uninitialized timer_list",
  "subsystem": "netfilter/xt_IDLETIMER",
  "bug_class": "use-before-initialization",
  "cve": "CVE-2026-23274",
  "target": {
    "kernel": "6.1-kasan",
    "git_commit": "830b3c68c1fb1e9176028d02ef86f3cf76aa2476",
    "config_required": [
      "CONFIG_USER_NS=y",
      "CONFIG_NET_NS=y",
      "CONFIG_NETFILTER=y",
      "CONFIG_NETFILTER_XTABLES=y",
      "CONFIG_NETFILTER_XT_TARGET_IDLETIMER=y",
      "CONFIG_IP_NF_IPTABLES=y"
    ]
  },
  "trigger": {
    "source": "pov/trigger.c",
    "binary": "pov/trigger",
    "run_as": "uid 1000 with no initial-namespace capabilities; CAP_NET_ADMIN only in owned namespaces",
    "timeout_seconds": 30,
    "deterministic": false
  },
  "expected": {
    "sanitizer": "KASAN",
    "signature": "KASAN: probably user-memory-access in range"
  },
  "reproduction": {
    "status": "verified",
    "evidence": "runtime-console.txt"
  }
}
