{
  "schema_version": 2,
  "id": "CVE-2025-38502",
  "title": "BPF tail-call cgroup local-storage size mismatch out-of-bounds read",
  "subsystem": "BPF cgroup local storage",
  "bug_class": "slab-out-of-bounds read",
  "cve": "CVE-2025-38502",
  "target": {
    "kernel": "6.1-kasan",
    "git_commit": "830b3c68c1fb1e9176028d02ef86f3cf76aa2476",
    "config_required": [
      "CONFIG_BPF=y",
      "CONFIG_BPF_SYSCALL=y",
      "CONFIG_CGROUPS=y",
      "CONFIG_CGROUP_BPF=y"
    ]
  },
  "trigger": {
    "source": "pov/trigger.c",
    "binary": "pov/trigger",
    "run_as": "uid 1000 with no capabilities; requires unprivileged BPF enabled",
    "timeout_seconds": 15,
    "deterministic": true
  },
  "expected": {
    "sanitizer": "KASAN",
    "signature": "BUG: KASAN: slab-out-of-bounds in array_map_update_elem; bpf_cgroup_storage_alloc"
  },
  "reproduction": {
    "status": "verified",
    "evidence": "runtime-console.txt"
  }
}
