{
  "schema_version": 2,
  "id": "CVE-2024-53141",
  "title": "bitmap:ip CIDR range out-of-bounds access",
  "subsystem": "netfilter ipset",
  "bug_class": "slab-out-of-bounds",
  "cve": "CVE-2024-53141",
  "target": {
    "kernel": "6.1-kasan",
    "git_commit": "830b3c68c1fb1e9176028d02ef86f3cf76aa2476",
    "config_required": [
      "CONFIG_NETFILTER=y",
      "CONFIG_IP_SET=y",
      "CONFIG_IP_SET_BITMAP_IP=y",
      "CONFIG_USER_NS=y",
      "CONFIG_NET_NS=y"
    ]
  },
  "trigger": {
    "source": "pov/trigger.c",
    "binary": "pov/trigger",
    "run_as": "uid 1000; no initial-namespace capabilities; CAP_NET_ADMIN only in owned namespaces",
    "timeout_seconds": 30,
    "deterministic": true
  },
  "expected": {
    "sanitizer": "KASAN",
    "signature": "BUG: KASAN: slab-out-of-bounds in bitmap_ip_add"
  },
  "reproduction": {
    "status": "verified",
    "evidence": "runtime-console.txt"
  }
}
