{
  "schema_version": 2,
  "id": "CVE-2026-23060",
  "title": "authencesn short-AAD scatterlist wild-memory access",
  "subsystem": "crypto/authencesn (AF_ALG)",
  "bug_class": "wild-memory-access",
  "cve": "CVE-2026-23060",
  "target": {
    "kernel": "6.1-kasan",
    "git_commit": "830b3c68c1fb1e9176028d02ef86f3cf76aa2476",
    "config_required": [
      "CONFIG_CRYPTO=y",
      "CONFIG_CRYPTO_AUTHENC=y",
      "CONFIG_CRYPTO_USER_API=y",
      "CONFIG_CRYPTO_USER_API_AEAD=y",
      "CONFIG_CRYPTO_HMAC=y",
      "CONFIG_CRYPTO_SHA256=y",
      "CONFIG_CRYPTO_CBC=y",
      "CONFIG_CRYPTO_AES=y"
    ]
  },
  "trigger": {
    "source": "pov/trigger.c",
    "binary": "pov/trigger",
    "run_as": "uid 1000 with no capabilities and no user namespace",
    "timeout_seconds": 30,
    "deterministic": true
  },
  "expected": {
    "sanitizer": "KASAN",
    "signature": "BUG: KASAN: wild-memory-access in scatterwalk_copychunks+0x22f/0x560"
  },
  "reproduction": {
    "status": "verified",
    "evidence": "runtime-console.txt"
  }
}
