{
  "schema_version": 2,
  "id": "CVE-2025-40019",
  "title": "ESSIV AEAD associated-data underflow causes invalid scatterlist traversal",
  "subsystem": "crypto/AF_ALG",
  "bug_class": "integer underflow leading to invalid scatterlist traversal",
  "cve": "CVE-2025-40019",
  "target": {
    "kernel": "6.1-kasan",
    "git_commit": "830b3c68c1fb1e9176028d02ef86f3cf76aa2476",
    "config_required": [
      "CONFIG_CRYPTO_USER_API=y",
      "CONFIG_CRYPTO_USER_API_AEAD=y",
      "CONFIG_CRYPTO_ESSIV=y",
      "CONFIG_CRYPTO_AUTHENC=y",
      "CONFIG_CRYPTO_HMAC=y",
      "CONFIG_CRYPTO_SHA256=y",
      "CONFIG_CRYPTO_CBC=y",
      "CONFIG_CRYPTO_AES=y"
    ]
  },
  "trigger": {
    "source": "pov/trigger.c",
    "binary": "pov/trigger",
    "run_as": "uid 1000 with no effective capabilities; no namespace required",
    "timeout_seconds": 30,
    "deterministic": true
  },
  "expected": {
    "sanitizer": "KASAN",
    "signature": "KASAN: null-ptr-deref in range [0x0000000000000008-0x000000000000000f]"
  },
  "reproduction": {
    "status": "verified",
    "evidence": "runtime-console.txt"
  }
}
